{
  "schema_version": "kubernetes-inspection/v2",
  "target_type": "KUBERNETES_CLUSTER",
  "overall_status": "WARNING",
  "completion_status": "PARTIAL",
  "summary": "检查 595 个集群对象，归并出 1 个根因组；业务区域 1 个，平台组件 0 个。",
  "repair_supported": false,
  "scope": {"namespaces": []},
  "checked_assets": 595,
  "snapshot": {
    "generated_at": "2026-08-11T06:00:00Z",
    "rule_set_version": "kubernetes-health-rules/2.0.0",
    "event_window_seconds": 3600,
    "transient_grace_seconds": 300,
    "truncated": false,
    "finding_count": 1
  },
  "coverage": [
    {"domain": "node", "status": "COMPLETE", "checked_count": 7, "failure_codes": [], "issue_count": 0},
    {"domain": "event", "status": "COMPLETE", "checked_count": 12, "failure_codes": [], "issue_count": 0}
  ],
  "findings": [
    {
      "finding_id": "1e49bd9e342888b8e7f8d6d0",
      "rule_id": "K8S_JOB_FAILED",
      "category": "job",
      "severity": "WARNING",
      "classification": "CURRENT_IMPACT",
      "area": "BUSINESS",
      "title": "Job 执行失败",
      "root_object_ref": {"kind": "Job", "namespace": "dev", "name": "task-run", "uid": "job-uid"},
      "affected_object_count": 5,
      "affected_object_refs": [{"kind": "Job", "namespace": "dev", "name": "task-run", "uid": "job-uid"}],
      "evidence": {"failed_pods": 4, "succeeded_pods": 0},
      "impact_scope": "dev",
      "recommendation": "请人工核查 Job Conditions、失败 Pod 的退出原因和业务输入。"
    }
  ],
  "interpretation": {
    "status": "UNAVAILABLE",
    "failure_code": "MODEL_CONNECTION_FAILED",
    "priorities": [],
    "limitations": ["AI 解读未生成，当前报告仅包含确定性规则结论。"]
  }
}
